{
  "version": "web-to-tui-production-deployment-preflight.v1",
  "environment": "production",
  "release": {
    "stable_version": "20260816170851",
    "release_id": "20260816170851",
    "source_commit": "fc145423c4de04cae20c3a6a2e94780505aa5938",
    "deployed_at": "2026-08-16T09:09:19Z"
  },
  "oci_image": {
    "image_id": "sha256:04d08b5d3e1b1032abfbbefbeb4d9df0f4a6f8c33c706981056c1f36031112eb",
    "revision": "fc145423c4de04cae20c3a6a2e94780505aa5938"
  },
  "production_health": {
    "checked_at": "2026-08-16T09:21:08Z",
    "health": {
      "http_status": 200,
      "status": "ok",
      "response_sha256": "374ce1945abfd549b08ce103c5155004f5f83317b08a4e9b5ac16e7ed3b6a469"
    },
    "readiness": {
      "http_status": 200,
      "status": "ok",
      "response_sha256": "7874fdb8c615d532d0da953a4d2f7df0d3d6511e0d3d8c6fb717706bda2f7007"
    }
  },
  "verified_at": "2026-08-16T09:21:08Z"
}
